{
  "$schema": "https://json-schema.org/draft/2020-12/schema",
  "type": "object",
  "additionalProperties": false,
  "required": [
    "command",
    "root",
    "generated_at",
    "filters",
    "summary",
    "candidates"
  ],
  "properties": {
    "command": {
      "const": "files"
    },
    "root": {
      "type": "string"
    },
    "scan_scope_root": {
      "type": "string"
    },
    "generated_at": {
      "type": "string",
      "format": "date-time"
    },
    "filters": {
      "type": "object",
      "additionalProperties": false,
      "required": [
        "categories",
        "name_contains",
        "path_contains",
        "extensions",
        "modified_after",
        "modified_before",
        "limit"
      ],
      "properties": {
        "categories": {
          "type": "array",
          "items": {
            "type": "string"
          }
        },
        "name_contains": {
          "type": "array",
          "items": {
            "type": "string"
          }
        },
        "path_contains": {
          "type": "array",
          "items": {
            "type": "string"
          }
        },
        "extensions": {
          "type": "array",
          "items": {
            "type": "string"
          }
        },
        "modified_after": {
          "type": [
            "string",
            "null"
          ]
        },
        "modified_before": {
          "type": [
            "string",
            "null"
          ]
        },
        "limit": {
          "type": "integer"
        },
        "known_good_hash_feeds": {
          "type": "array",
          "items": {
            "type": "string"
          }
        },
        "hide_known_good": {
          "type": "boolean"
        },
        "known_good_max_hash_bytes": {
          "type": "integer"
        }
      }
    },
    "summary": {
      "type": "object",
      "additionalProperties": false,
      "required": [
        "scanned_file_count",
        "candidate_count",
        "category_counts",
        "newest_modified_at",
        "oldest_modified_at"
      ],
      "properties": {
        "scanned_file_count": {
          "type": "integer"
        },
        "candidate_count": {
          "type": "integer"
        },
        "raw_candidate_count": {
          "type": "integer"
        },
        "category_counts": {
          "type": "object",
          "additionalProperties": {
            "type": "integer"
          }
        },
        "newest_modified_at": {
          "type": [
            "string",
            "null"
          ]
        },
        "oldest_modified_at": {
          "type": [
            "string",
            "null"
          ]
        },
        "duplicate_group_count": {
          "type": "integer"
        },
        "duplicate_file_count": {
          "type": "integer"
        },
        "fuzzy_text_duplicate_group_count": {
          "type": "integer"
        },
        "fuzzy_text_duplicate_file_count": {
          "type": "integer"
        },
        "known_good_feed_count": {
          "type": "integer"
        },
        "known_good_hash_count": {
          "type": "integer"
        },
        "known_good_match_count": {
          "type": "integer"
        },
        "known_good_suppressed_count": {
          "type": "integer"
        },
        "known_good_hash_skipped_large_count": {
          "type": "integer"
        },
        "known_good_nsrl_rds_feed_count": {
          "type": "integer"
        },
        "known_good_nsrl_rds_row_count": {
          "type": "integer"
        },
        "candidate_kind_counts": {
          "type": "object",
          "additionalProperties": {
            "type": "integer"
          }
        },
        "signature_checked_count": {
          "type": "integer"
        },
        "signature_mismatch_count": {
          "type": "integer"
        },
        "signature_unrecognized_known_extension_count": {
          "type": "integer"
        },
        "commercial_gap_ids": {
          "type": "array",
          "items": {
            "type": "string"
          }
        },
        "matched_rule_count": {
          "type": "integer"
        },
        "ioc_hit_count": {
          "type": "integer"
        },
        "time_origin": {
          "type": [
            "string",
            "null"
          ]
        },
        "source_file_mtime_range": {
          "type": "object"
        },
        "excluded_file_count": {
          "type": "integer"
        },
        "exclusion_reason_counts": {
          "type": "object"
        },
        "excluded_category_counts": {
          "type": "object"
        },
        "limit_reached": {
          "type": "boolean"
        },
        "attribute_counts": {
          "type": "object"
        },
        "deleted_flag_counts": {
          "type": "object"
        },
        "duplicate_hash_profile": {
          "type": "object"
        },
        "duplicate_groups_truncated": {
          "type": "boolean"
        },
        "fuzzy_text_duplicate_profile": {
          "type": "object"
        },
        "fuzzy_text_duplicates_truncated": {
          "type": "boolean"
        },
        "mismatch_candidates_truncated": {
          "type": "boolean"
        },
        "signature_population": {
          "type": [
            "object",
            "null"
          ]
        },
        "hashed_candidate_count": {
          "type": [
            "integer",
            "null"
          ]
        },
        "inventory_count": {
          "type": [
            "integer",
            "null"
          ]
        },
        "inventory_category_counts": {
          "type": [
            "object",
            "null"
          ]
        },
        "inventory_note": {
          "type": [
            "string",
            "null"
          ]
        }
      }
    },
    "candidates": {
      "type": "array",
      "items": {
        "type": "object",
        "additionalProperties": false,
        "required": [
          "path",
          "name",
          "extension",
          "size",
          "modified_at",
          "modified_epoch",
          "categories",
          "reasons"
        ],
        "properties": {
          "path": {
            "type": "string"
          },
          "name": {
            "type": "string"
          },
          "extension": {
            "type": "string"
          },
          "size": {
            "type": "integer"
          },
          "modified_at": {
            "type": "string",
            "format": "date-time"
          },
          "modified_epoch": {
            "type": "number"
          },
          "categories": {
            "type": "array",
            "items": {
              "type": "string"
            }
          },
          "reasons": {
            "type": "object",
            "additionalProperties": {
              "type": "array",
              "items": {
                "type": "string"
              }
            }
          },
          "matched_rules": {
            "type": "array",
            "items": {
              "type": "string"
            }
          },
          "ioc_hits": {
            "type": "array",
            "items": {
              "type": "object",
              "additionalProperties": false,
              "required": [
                "rule_id",
                "type",
                "value"
              ],
              "properties": {
                "rule_id": {
                  "type": "string"
                },
                "type": {
                  "type": "string"
                },
                "value": {
                  "type": "string"
                },
                "count": {
                  "type": "integer"
                }
              }
            }
          },
          "known_good_status": {
            "type": "string"
          },
          "known_good_error": {
            "type": "string"
          },
          "known_good_match": {
            "type": "object",
            "additionalProperties": true
          },
          "report_suppression_status": {
            "type": "string"
          },
          "analyst_review_required": {
            "type": "boolean"
          },
          "file_signature": {
            "type": "object",
            "additionalProperties": true
          },
          "recovery": {
            "type": "object",
            "additionalProperties": true,
            "required": [
              "schema",
              "candidate_kind",
              "confidence",
              "validation_status",
              "limitations",
              "reportability",
              "commercial_claim_allowed"
            ],
            "properties": {
              "schema": {
                "type": "string"
              },
              "candidate_kind": {
                "enum": [
                  "existing",
                  "deleted-entry",
                  "orphan-record",
                  "carved",
                  "partial-corrupt"
                ]
              },
              "subtype": {
                "type": [
                  "string",
                  "null"
                ]
              },
              "confidence": {
                "enum": [
                  "high",
                  "medium",
                  "low",
                  "unknown"
                ]
              },
              "validation_status": {
                "enum": [
                  "unverified",
                  "validated",
                  "partial",
                  "rejected"
                ]
              },
              "deletion_state": {
                "type": [
                  "string",
                  "null"
                ]
              },
              "source_id": {
                "type": [
                  "string",
                  "null"
                ]
              },
              "source_path": {
                "type": [
                  "string",
                  "null"
                ]
              },
              "source_record_id": {
                "type": [
                  "string",
                  "null"
                ]
              },
              "source_offset": {
                "type": [
                  "integer",
                  "null"
                ]
              },
              "boundary_method": {
                "type": [
                  "string",
                  "null"
                ]
              },
              "signature_type": {
                "type": [
                  "string",
                  "null"
                ]
              },
              "limitations": {
                "type": "array",
                "items": {
                  "type": "string"
                }
              },
              "reportability": {
                "type": "string"
              },
              "commercial_claim_allowed": {
                "type": "boolean"
              }
            }
          },
          "relative_path": {
            "type": [
              "string",
              "null"
            ]
          },
          "time_origin": {
            "type": [
              "string",
              "null"
            ]
          },
          "modified_at_origin": {
            "type": [
              "string",
              "null"
            ]
          },
          "source_file_mtime": {
            "type": [
              "string",
              "null"
            ]
          },
          "source_file_ctime": {
            "type": [
              "string",
              "null"
            ]
          },
          "source_file_atime": {
            "type": [
              "string",
              "null"
            ]
          },
          "fs_modified_at": {
            "type": [
              "string",
              "integer",
              "number",
              "boolean",
              "object",
              "array",
              "null"
            ]
          },
          "fs_created_at": {
            "type": [
              "string",
              "integer",
              "number",
              "boolean",
              "object",
              "array",
              "null"
            ]
          },
          "fs_accessed_at": {
            "type": [
              "string",
              "integer",
              "number",
              "boolean",
              "object",
              "array",
              "null"
            ]
          },
          "fs_changed_at": {
            "type": [
              "string",
              "integer",
              "number",
              "boolean",
              "object",
              "array",
              "null"
            ]
          },
          "attributes": {
            "type": "array"
          },
          "attributes_origin": {
            "type": [
              "string",
              "null"
            ]
          },
          "is_deleted": {
            "type": [
              "string",
              "integer",
              "number",
              "boolean",
              "object",
              "array",
              "null"
            ]
          },
          "hashes": {
            "type": [
              "object",
              "null"
            ]
          },
          "hash_scope": {
            "type": [
              "string",
              "null"
            ]
          }
        }
      }
    },
    "known_good_suppression_profile": {
      "type": "object",
      "additionalProperties": true
    },
    "known_good_suppressed_candidates": {
      "type": "array",
      "items": {
        "type": "object",
        "additionalProperties": true
      }
    },
    "file_signature_profile": {
      "type": "object",
      "additionalProperties": true
    },
    "signature_mismatch_candidates": {
      "type": "array",
      "items": {
        "type": "object",
        "additionalProperties": true
      }
    },
    "duplicate_content_groups": {
      "type": "array",
      "items": {
        "type": "object",
        "additionalProperties": false,
        "required": [
          "sha256",
          "file_count",
          "size",
          "paths",
          "truncated_paths"
        ],
        "properties": {
          "sha256": {
            "type": "string"
          },
          "file_count": {
            "type": "integer"
          },
          "size": {
            "type": "integer"
          },
          "paths": {
            "type": "array",
            "items": {
              "type": "string"
            }
          },
          "truncated_paths": {
            "type": "boolean"
          },
          "commercial_gap_ids": {
            "type": "array",
            "items": {
              "type": "string"
            }
          },
          "group_id": {
            "type": "string"
          },
          "group_fingerprint": {
            "type": "string"
          },
          "representative_path": {
            "type": "string"
          },
          "representative_name": {
            "type": "string"
          },
          "report_suppression_status": {
            "type": "string"
          },
          "analyst_review_required": {
            "type": "boolean"
          },
          "suppression_policy": {
            "type": "object",
            "additionalProperties": true
          },
          "duplicate_resolution_status": {
            "type": "string"
          }
        }
      }
    },
    "fuzzy_text_duplicate_groups": {
      "type": "array",
      "items": {
        "type": "object",
        "additionalProperties": true,
        "required": [
          "group_id",
          "group_fingerprint",
          "file_count",
          "paths",
          "truncated_paths",
          "match_type",
          "report_suppression_status"
        ],
        "properties": {
          "group_id": {
            "type": "string"
          },
          "group_fingerprint": {
            "type": "string"
          },
          "file_count": {
            "type": "integer"
          },
          "representative_path": {
            "type": "string"
          },
          "representative_name": {
            "type": "string"
          },
          "paths": {
            "type": "array",
            "items": {
              "type": "string"
            }
          },
          "truncated_paths": {
            "type": "boolean"
          },
          "min_similarity": {
            "type": "number"
          },
          "match_type": {
            "type": "string"
          },
          "normalized_sha256_values": {
            "type": "array",
            "items": {
              "type": "string"
            }
          },
          "commercial_gap_ids": {
            "type": "array",
            "items": {
              "type": "string"
            }
          },
          "duplicate_resolution_status": {
            "type": "string"
          },
          "report_suppression_status": {
            "type": "string"
          },
          "analyst_review_required": {
            "type": "boolean"
          },
          "suppression_policy": {
            "type": "object",
            "additionalProperties": true
          }
        }
      }
    },
    "duplicate_content_manifest": {
      "type": "object",
      "additionalProperties": true
    },
    "hash_cache_assessment": {
      "type": "object",
      "additionalProperties": true
    },
    "hash_cache_manifest": {
      "type": "object",
      "additionalProperties": true
    },
    "duplicate_detection_assessment": {
      "type": "object",
      "additionalProperties": true
    },
    "core_accuracy_gates": {
      "type": "array",
      "items": {
        "type": "object",
        "additionalProperties": true
      }
    },
    "rule_set": {
      "type": "object",
      "additionalProperties": false,
      "required": [
        "path",
        "format",
        "rule_count"
      ],
      "properties": {
        "path": {
          "type": "string"
        },
        "format": {
          "type": "string"
        },
        "rule_count": {
          "type": "integer"
        }
      }
    },
    "matched_rules": {
      "type": "array",
      "items": {
        "type": "string"
      }
    },
    "ioc_hits": {
      "type": "array",
      "items": {
        "type": "object",
        "additionalProperties": false,
        "required": [
          "rule_id",
          "type",
          "value"
        ],
        "properties": {
          "rule_id": {
            "type": "string"
          },
          "type": {
            "type": "string"
          },
          "value": {
            "type": "string"
          },
          "count": {
            "type": "integer"
          }
        }
      }
    },
    "time_provenance": {
      "type": "object"
    },
    "file_exclusions": {
      "type": "object"
    },
    "inventory": {
      "type": [
        "array",
        "null"
      ]
    }
  }
}
